"id","categoria","nombre","descripcion","precio","img","whatsapp_text"
"arco-1","arco","Espejo Arco Classic","Espejo de cuerpo completo con diseño de arco y marco cálido.","$2,500 - $3,500 MXN","img/arco/arco1.jpeg","Hola, me interesa el Espejo Arco Classic. ¿Me puedes dar más información?"
"arco-2","arco","Espejo Arco Natural","Diseño elegante para recámaras, salas y vestidores.","$2,800 - $3,800 MXN","img/arco/arco2.jpeg","Hola, me interesa el Espejo Arco Natural. ¿Me puedes dar más información?"
"arco-3","arco","Espejo Arco Full Body","Espejo vertical ideal para ampliar visualmente tus espacios.","$3,000 - $4,200 MXN","img/arco/arco3.jpeg","Hola, me interesa el Espejo Arco Full Body. ¿Me puedes dar más información?"
"arco-4","arco","Espejo Arco Minimal","Estilo minimalista con acabado natural y líneas suaves.","$2,700 - $3,700 MXN","img/arco/arco4.jpeg","Hola, me interesa el Espejo Arco Minimal. ¿Me puedes dar más información?"
"irregulares-1","irregulares","Espejo Onda Serena","Diseño irregular con líneas suaves que aporta movimiento y personalidad al espacio.","$1,900 - $2,700 MXN","img/irregulares/espero1.jpeg","Hola, me interesa el Espejo Onda Serena. ¿Me puedes dar más información?"
"irregulares-2","irregulares","Espejo Bruma Orgánica","Espejo decorativo de silueta libre, ideal para crear un punto focal elegante y natural.","$2,100 - $2,900 MXN","img/irregulares/espero5.jpeg","Hola, me interesa el Espejo Bruma Orgánica. ¿Me puedes dar más información?"
"redondos-1","redondos","Espejo Círculo Aura","Espejo redondo de estilo cálido y limpio, perfecto para recibidores, salas o tocadores.","$1,600 - $2,300 MXN","img/redondos/espero4.jpeg","Hola, me interesa el Espejo Círculo Aura. ¿Me puedes dar más información?"
"redondos-2","redondos","Espejo Sol de Casa","Diseño circular minimalista que ilumina visualmente el espacio y aporta equilibrio.","$1,800 - $2,600 MXN","img/redondos/espero8.jpeg","Hola, me interesa el Espejo Sol de Casa. ¿Me puedes dar más información?"
